[
  {
    "asset_id": "IAB-DEMO-ROOM",
    "parent_id": "A26",
    "name": "Rockwell Integrated Architecture Demo Wall",
    "asset_class": "demo_wall",
    "record_status": "proposed",
    "quantity_estimate": 1,
    "model_verified": null,
    "catalog_number_verified": null,
    "candidate_catalog_family": null,
    "manufacturer_candidate": null,
    "description": "Main demonstration wall containing six process skids and common overhead cable tray / demo-room infrastructure.",
    "photo": "IMG_0192.jpeg",
    "evidence": [
      {
        "source_id": "SRC-001",
        "locator": "IAB_Project_Tree!row 2",
        "claim_status": "inherited_unverified"
      }
    ],
    "verification_action": "Confirm physical boundary, parent placement, and destination tenant category.",
    "category_tenant": null
  },
  {
    "asset_id": "IAB-SKID-01",
    "parent_id": "IAB-DEMO-ROOM",
    "name": "PLC / Network Core Process Skid",
    "asset_class": "process_skid",
    "record_status": "proposed",
    "quantity_estimate": 1,
    "model_verified": null,
    "catalog_number_verified": null,
    "candidate_catalog_family": null,
    "manufacturer_candidate": null,
    "description": "Central PLC/network/power skid with CompactLogix-style controller, Ethernet switch/security appliance, 22 mm operator devices, protection devices, and field terminal blocks.",
    "photo": "IMG_0196.jpeg",
    "evidence": [
      {
        "source_id": "SRC-001",
        "locator": "IAB_Project_Tree!row 3",
        "claim_status": "inherited_unverified"
      }
    ],
    "verification_action": "Confirm physical boundary, parent placement, and destination tenant category.",
    "category_tenant": null
  },
  {
    "asset_id": "IAB-SKID-02",
    "parent_id": "IAB-DEMO-ROOM",
    "name": "VFD and Motion Drive Process Skid",
    "asset_class": "process_skid",
    "record_status": "proposed",
    "quantity_estimate": 1,
    "model_verified": null,
    "catalog_number_verified": null,
    "candidate_catalog_family": null,
    "manufacturer_candidate": null,
    "description": "Drive technology skid with PowerFlex 755TS VFD, Kinetix servo drive modules, branch protection, contactors, and distributed terminal blocks.",
    "photo": "IMG_0199.jpeg",
    "evidence": [
      {
        "source_id": "SRC-001",
        "locator": "IAB_Project_Tree!row 4",
        "claim_status": "inherited_unverified"
      }
    ],
    "verification_action": "Confirm physical boundary, parent placement, and destination tenant category.",
    "category_tenant": null
  },
  {
    "asset_id": "IAB-SKID-03",
    "parent_id": "IAB-DEMO-ROOM",
    "name": "GuardLogix HMI Safety Process Skid",
    "asset_class": "process_skid",
    "record_status": "proposed",
    "quantity_estimate": 1,
    "model_verified": null,
    "catalog_number_verified": null,
    "candidate_catalog_family": null,
    "manufacturer_candidate": null,
    "description": "HMI and safety automation skid with PanelView, Compact GuardLogix/CompactLogix class controller, safety I/O, ArmorBlock/field I/O, and operator controls.",
    "photo": "IMG_0201.jpeg",
    "evidence": [
      {
        "source_id": "SRC-001",
        "locator": "IAB_Project_Tree!row 5",
        "claim_status": "inherited_unverified"
      }
    ],
    "verification_action": "Confirm physical boundary, parent placement, and destination tenant category.",
    "category_tenant": null
  },
  {
    "asset_id": "IAB-SKID-04",
    "parent_id": "IAB-DEMO-ROOM",
    "name": "Servo Motion Safety Cell Skid",
    "asset_class": "process_skid",
    "record_status": "proposed",
    "quantity_estimate": 1,
    "model_verified": null,
    "catalog_number_verified": null,
    "candidate_catalog_family": null,
    "manufacturer_candidate": null,
    "description": "Motion cell skid with Kinetix class servo drive, servo motor/axis hardware, safety interlocks, safety switch/guard locking, POINT I/O, and terminal marshalling.",
    "photo": "IMG_0205.jpeg",
    "evidence": [
      {
        "source_id": "SRC-001",
        "locator": "IAB_Project_Tree!row 6",
        "claim_status": "inherited_unverified"
      }
    ],
    "verification_action": "Confirm physical boundary, parent placement, and destination tenant category.",
    "category_tenant": null
  },
  {
    "asset_id": "IAB-SKID-05",
    "parent_id": "IAB-DEMO-ROOM",
    "name": "Guarding / E-Stop Safety Demonstration Skid",
    "asset_class": "process_skid",
    "record_status": "proposed",
    "quantity_estimate": 1,
    "model_verified": null,
    "catalog_number_verified": null,
    "candidate_catalog_family": null,
    "manufacturer_candidate": null,
    "description": "Machine safety demonstration skid with zone E-stops, GuardShield light curtains, Guardmaster safety switches, ArmorBlock safety I/O, and safety/status lamps.",
    "photo": "IMG_0206.jpeg",
    "evidence": [
      {
        "source_id": "SRC-001",
        "locator": "IAB_Project_Tree!row 7",
        "claim_status": "inherited_unverified"
      }
    ],
    "verification_action": "Confirm physical boundary, parent placement, and destination tenant category.",
    "category_tenant": null
  },
  {
    "asset_id": "IAB-SKID-06",
    "parent_id": "IAB-DEMO-ROOM",
    "name": "Compact Machine Control and Drives Skid",
    "asset_class": "process_skid",
    "record_status": "proposed",
    "quantity_estimate": 1,
    "model_verified": null,
    "catalog_number_verified": null,
    "candidate_catalog_family": null,
    "manufacturer_candidate": null,
    "description": "Compact machine control skid with HMI, Stratix switch, PLC, distributed I/O, VFD/servo technology, power distribution, and linear actuator/motor load.",
    "photo": "IMG_0209.jpeg",
    "evidence": [
      {
        "source_id": "SRC-001",
        "locator": "IAB_Project_Tree!row 8",
        "claim_status": "inherited_unverified"
      }
    ],
    "verification_action": "Confirm physical boundary, parent placement, and destination tenant category.",
    "category_tenant": null
  },
  {
    "asset_id": "IAB-SKID-01-B010",
    "parent_id": "IAB-SKID-01",
    "name": "SKID-01 - PLC / PAC",
    "asset_class": "PLC Controller",
    "record_status": "estimated",
    "quantity_estimate": 1.0,
    "model_verified": null,
    "catalog_number_verified": null,
    "candidate_catalog_family": "1769 / 5069 CompactLogix family",
    "manufacturer_candidate": "Allen-Bradley",
    "description": "CompactLogix / CompactLogix-style controller with Ethernet and I/O rack visible near top",
    "photo": "IMG_0196 top center",
    "evidence": [
      {
        "source_id": "SRC-001",
        "locator": "Skid_BOM!row 2",
        "claim_status": "inherited_unverified"
      }
    ],
    "verification_action": "Read controller nameplate or Studio 5000 project for exact CPU and memory option.",
    "category_tenant": null
  },
  {
    "asset_id": "IAB-SKID-01-B020",
    "parent_id": "IAB-SKID-01",
    "name": "SKID-01 - Industrial firewall / security appliance",
    "asset_class": "Network Security Appliance",
    "record_status": "estimated",
    "quantity_estimate": 1.0,
    "model_verified": null,
    "catalog_number_verified": null,
    "candidate_catalog_family": "FortiGate / Fortinet industrial firewall",
    "manufacturer_candidate": "Fortinet",
    "description": "Fortinet FortiGate industrial/security appliance on lower left",
    "photo": "IMG_0196 lower left",
    "evidence": [
      {
        "source_id": "SRC-001",
        "locator": "Skid_BOM!row 3",
        "claim_status": "inherited_unverified"
      }
    ],
    "verification_action": "Confirm model, ports, power requirements, and whether included in IAB as non-RA device.",
    "category_tenant": null
  },
  {
    "asset_id": "IAB-SKID-01-B030",
    "parent_id": "IAB-SKID-01",
    "name": "SKID-01 - Industrial Ethernet switch",
    "asset_class": "Ethernet Switch",
    "record_status": "estimated",
    "quantity_estimate": 1.0,
    "model_verified": null,
    "catalog_number_verified": null,
    "candidate_catalog_family": "Stratix 2000/5700 candidate or third-party switch",
    "manufacturer_candidate": "Allen-Bradley / third-party",
    "description": "Small DIN-rail managed/unmanaged Ethernet switch adjacent to firewall",
    "photo": "IMG_0196 lower center",
    "evidence": [
      {
        "source_id": "SRC-001",
        "locator": "Skid_BOM!row 4",
        "claim_status": "inherited_unverified"
      }
    ],
    "verification_action": "Identify label and number of copper/fiber ports.",
    "category_tenant": null
  },
  {
    "asset_id": "IAB-SKID-01-B040",
    "parent_id": "IAB-SKID-01",
    "name": "SKID-01 - Circuit protection",
    "asset_class": "Circuit Protection",
    "record_status": "estimated",
    "quantity_estimate": 3.0,
    "model_verified": null,
    "catalog_number_verified": null,
    "candidate_catalog_family": "140G / 1489-M / 1492-SP family",
    "manufacturer_candidate": "Allen-Bradley",
    "description": "Molded case breaker and DIN rail branch protection",
    "photo": "IMG_0196 mid/lower panel",
    "evidence": [
      {
        "source_id": "SRC-001",
        "locator": "Skid_BOM!row 5",
        "claim_status": "inherited_unverified"
      }
    ],
    "verification_action": "Verify voltage, current ratings and SCCR requirements.",
    "category_tenant": null
  },
  {
    "asset_id": "IAB-SKID-01-B050",
    "parent_id": "IAB-SKID-01",
    "name": "SKID-01 - 22 mm pushbuttons / pilot devices",
    "asset_class": "Operator Device",
    "record_status": "estimated",
    "quantity_estimate": 12.0,
    "model_verified": null,
    "catalog_number_verified": null,
    "candidate_catalog_family": "800F / 800T / 800H family",
    "manufacturer_candidate": "Allen-Bradley",
    "description": "Multi-color operator pushbuttons, illuminated indicators, mushroom E-stop",
    "photo": "IMG_0196 center",
    "evidence": [
      {
        "source_id": "SRC-001",
        "locator": "Skid_BOM!row 6",